{
  "schema_version": "1.0.0",
  "title": "Genesis Engine — Unity Capability Parity Target",
  "purpose": "Machine-readable clean-room capability target for building complete games with Genesis Engine.",
  "baseline": "Unity-inspired capability inventory; not a claim of implementation, exhaustive parity with every Unity version/package/platform, or permission to copy proprietary source/assets.",
  "lifecycle_statuses": [
    "NOT_ASSESSED",
    "SPECIFIED",
    "MAPPED",
    "IMPLEMENTED",
    "VERIFIED",
    "BLOCKED",
    "EXCLUDED",
    "EXTERNAL_DEPENDENCY"
  ],
  "domain_count": 25,
  "capability_count": 313,
  "domain_counts": {
    "editor_project": 12,
    "runtime_lifecycle": 10,
    "scene_world": 11,
    "render_pipeline": 20,
    "assets_content": 16,
    "prefabs_data": 12,
    "scripting": 14,
    "visual_scripting": 12,
    "physics": 14,
    "animation": 15,
    "audio": 12,
    "ui": 13,
    "input": 12,
    "ai_navigation": 12,
    "networking": 13,
    "terrain_environment": 12,
    "procedural": 10,
    "cinematics": 12,
    "build_platforms": 14,
    "testing_profiling": 14,
    "packages_collaboration": 12,
    "xr": 10,
    "localization": 9,
    "security_reliability": 10,
    "extensibility": 12
  },
  "capabilities": [
    {
      "id": "UNITY-EDITOR_PROJECT-001",
      "domain": "editor_project",
      "domain_label": "Editor, Projekt und Workflow",
      "target_contract": "Projekt erstellen und öffnen",
      "priority": "P1",
      "status": "NOT_ASSESSED",
      "source_binding": null,
      "acceptance_evidence": [],
      "dependencies": [],
      "notes": "Clean-room Zielanforderung für Unity-ähnliche Fähigkeit; keine Aussage über vorhandene Implementierung oder vollständige Gleichwertigkeit."
    },
    {
      "id": "UNITY-EDITOR_PROJECT-002",
      "domain": "editor_project",
      "domain_label": "Editor, Projekt und Workflow",
      "target_contract": "Projektvorlagen und Presets",
      "priority": "P1",
      "status": "NOT_ASSESSED",
      "source_binding": null,
      "acceptance_evidence": [],
      "dependencies": [],
      "notes": "Clean-room Zielanforderung für Unity-ähnliche Fähigkeit; keine Aussage über vorhandene Implementierung oder vollständige Gleichwertigkeit."
    },
    {
      "id": "UNITY-EDITOR_PROJECT-003",
      "domain": "editor_project",
      "domain_label": "Editor, Projekt und Workflow",
      "target_contract": "Szenen-Editor",
      "priority": "P1",
      "status": "NOT_ASSESSED",
      "source_binding": null,
      "acceptance_evidence": [],
      "dependencies": [],
      "notes": "Clean-room Zielanforderung für Unity-ähnliche Fähigkeit; keine Aussage über vorhandene Implementierung oder vollständige Gleichwertigkeit."
    },
    {
      "id": "UNITY-EDITOR_PROJECT-004",
      "domain": "editor_project",
      "domain_label": "Editor, Projekt und Workflow",
      "target_contract": "Game-View und Scene-View",
      "priority": "P1",
      "status": "NOT_ASSESSED",
      "source_binding": null,
      "acceptance_evidence": [],
      "dependencies": [],
      "notes": "Clean-room Zielanforderung für Unity-ähnliche Fähigkeit; keine Aussage über vorhandene Implementierung oder vollständige Gleichwertigkeit."
    },
    {
      "id": "UNITY-EDITOR_PROJECT-005",
      "domain": "editor_project",
      "domain_label": "Editor, Projekt und Workflow",
      "target_contract": "Inspector und Property Editing",
      "priority": "P1",
      "status": "NOT_ASSESSED",
      "source_binding": null,
      "acceptance_evidence": [],
      "dependencies": [],
      "notes": "Clean-room Zielanforderung für Unity-ähnliche Fähigkeit; keine Aussage über vorhandene Implementierung oder vollständige Gleichwertigkeit."
    },
    {
      "id": "UNITY-EDITOR_PROJECT-006",
      "domain": "editor_project",
      "domain_label": "Editor, Projekt und Workflow",
      "target_contract": "Hierarchy und Objektverwaltung",
      "priority": "P1",
      "status": "NOT_ASSESSED",
      "source_binding": null,
      "acceptance_evidence": [],
      "dependencies": [],
      "notes": "Clean-room Zielanforderung für Unity-ähnliche Fähigkeit; keine Aussage über vorhandene Implementierung oder vollständige Gleichwertigkeit."
    },
    {
      "id": "UNITY-EDITOR_PROJECT-007",
      "domain": "editor_project",
      "domain_label": "Editor, Projekt und Workflow",
      "target_contract": "Gizmos und Handles",
      "priority": "P1",
      "status": "NOT_ASSESSED",
      "source_binding": null,
      "acceptance_evidence": [],
      "dependencies": [],
      "notes": "Clean-room Zielanforderung für Unity-ähnliche Fähigkeit; keine Aussage über vorhandene Implementierung oder vollständige Gleichwertigkeit."
    },
    {
      "id": "UNITY-EDITOR_PROJECT-008",
      "domain": "editor_project",
      "domain_label": "Editor, Projekt und Workflow",
      "target_contract": "Docking und anpassbare Layouts",
      "priority": "P1",
      "status": "NOT_ASSESSED",
      "source_binding": null,
      "acceptance_evidence": [],
      "dependencies": [],
      "notes": "Clean-room Zielanforderung für Unity-ähnliche Fähigkeit; keine Aussage über vorhandene Implementierung oder vollständige Gleichwertigkeit."
    },
    {
      "id": "UNITY-EDITOR_PROJECT-009",
      "domain": "editor_project",
      "domain_label": "Editor, Projekt und Workflow",
      "target_contract": "Shortcuts und Command Palette",
      "priority": "P1",
      "status": "NOT_ASSESSED",
      "source_binding": null,
      "acceptance_evidence": [],
      "dependencies": [],
      "notes": "Clean-room Zielanforderung für Unity-ähnliche Fähigkeit; keine Aussage über vorhandene Implementierung oder vollständige Gleichwertigkeit."
    },
    {
      "id": "UNITY-EDITOR_PROJECT-010",
      "domain": "editor_project",
      "domain_label": "Editor, Projekt und Workflow",
      "target_contract": "Undo/Redo und Änderungsverlauf",
      "priority": "P1",
      "status": "NOT_ASSESSED",
      "source_binding": null,
      "acceptance_evidence": [],
      "dependencies": [],
      "notes": "Clean-room Zielanforderung für Unity-ähnliche Fähigkeit; keine Aussage über vorhandene Implementierung oder vollständige Gleichwertigkeit."
    },
    {
      "id": "UNITY-EDITOR_PROJECT-011",
      "domain": "editor_project",
      "domain_label": "Editor, Projekt und Workflow",
      "target_contract": "Multi-Scene-Workflow",
      "priority": "P1",
      "status": "NOT_ASSESSED",
      "source_binding": null,
      "acceptance_evidence": [],
      "dependencies": [],
      "notes": "Clean-room Zielanforderung für Unity-ähnliche Fähigkeit; keine Aussage über vorhandene Implementierung oder vollständige Gleichwertigkeit."
    },
    {
      "id": "UNITY-EDITOR_PROJECT-012",
      "domain": "editor_project",
      "domain_label": "Editor, Projekt und Workflow",
      "target_contract": "Editor-Konfiguration und Preferences",
      "priority": "P1",
      "status": "NOT_ASSESSED",
      "source_binding": null,
      "acceptance_evidence": [],
      "dependencies": [],
      "notes": "Clean-room Zielanforderung für Unity-ähnliche Fähigkeit; keine Aussage über vorhandene Implementierung oder vollständige Gleichwertigkeit."
    },
    {
      "id": "UNITY-RUNTIME_LIFECYCLE-001",
      "domain": "runtime_lifecycle",
      "domain_label": "Runtime und Lebenszyklus",
      "target_contract": "Application Lifecycle",
      "priority": "P0",
      "status": "NOT_ASSESSED",
      "source_binding": null,
      "acceptance_evidence": [],
      "dependencies": [],
      "notes": "Clean-room Zielanforderung für Unity-ähnliche Fähigkeit; keine Aussage über vorhandene Implementierung oder vollständige Gleichwertigkeit."
    },
    {
      "id": "UNITY-RUNTIME_LIFECYCLE-002",
      "domain": "runtime_lifecycle",
      "domain_label": "Runtime und Lebenszyklus",
      "target_contract": "GameObject/Component-Modell",
      "priority": "P0",
      "status": "NOT_ASSESSED",
      "source_binding": null,
      "acceptance_evidence": [],
      "dependencies": [],
      "notes": "Clean-room Zielanforderung für Unity-ähnliche Fähigkeit; keine Aussage über vorhandene Implementierung oder vollständige Gleichwertigkeit."
    },
    {
      "id": "UNITY-RUNTIME_LIFECYCLE-003",
      "domain": "runtime_lifecycle",
      "domain_label": "Runtime und Lebenszyklus",
      "target_contract": "Komponenten-Lebenszyklus",
      "priority": "P0",
      "status": "NOT_ASSESSED",
      "source_binding": null,
      "acceptance_evidence": [],
      "dependencies": [],
      "notes": "Clean-room Zielanforderung für Unity-ähnliche Fähigkeit; keine Aussage über vorhandene Implementierung oder vollständige Gleichwertigkeit."
    },
    {
      "id": "UNITY-RUNTIME_LIFECYCLE-004",
      "domain": "runtime_lifecycle",
      "domain_label": "Runtime und Lebenszyklus",
      "target_contract": "Update/FixedUpdate/LateUpdate-Taktung",
      "priority": "P0",
      "status": "NOT_ASSESSED",
      "source_binding": null,
      "acceptance_evidence": [],
      "dependencies": [],
      "notes": "Clean-room Zielanforderung für Unity-ähnliche Fähigkeit; keine Aussage über vorhandene Implementierung oder vollständige Gleichwertigkeit."
    },
    {
      "id": "UNITY-RUNTIME_LIFECYCLE-005",
      "domain": "runtime_lifecycle",
      "domain_label": "Runtime und Lebenszyklus",
      "target_contract": "Coroutine- und Async-Ausführung",
      "priority": "P0",
      "status": "NOT_ASSESSED",
      "source_binding": null,
      "acceptance_evidence": [],
      "dependencies": [],
      "notes": "Clean-room Zielanforderung für Unity-ähnliche Fähigkeit; keine Aussage über vorhandene Implementierung oder vollständige Gleichwertigkeit."
    },
    {
      "id": "UNITY-RUNTIME_LIFECYCLE-006",
      "domain": "runtime_lifecycle",
      "domain_label": "Runtime und Lebenszyklus",
      "target_contract": "Zeit- und Zeitskalierung",
      "priority": "P0",
      "status": "NOT_ASSESSED",